{
  "schemaVersion": 1,
  "deploymentId": "deploy:customer-beta:1.0.0",
  "applicationId": "customer-beta",
  "environment": "staging",
  "deployedAt": "2026-09-01T12:15:00.000Z",
  "approvedBy": {
    "kind": "workflow",
    "identity": "rootkeystudio/k-nex-platform-core/.github/workflows/deploy.yml@d6c488e4371f43003245c2857d43e935f404e0cd"
  },
  "artifactDigest": "sha256:88f21339c26b12567fd959a719d856d6d4a2accada543f82dd11f5caaccff82f",
  "inventoryDigest": "sha256:7e74b3b05cdd4c57be3ed4ba329e5ba97f4746ec8333916de87a6d18a96a235c",
  "migrationRevision": 1,
  "smoke": {
    "status": "passed",
    "checks": [
      "authenticated-sales",
      "public-shell"
    ]
  },
  "readiness": "ready"
}
