{
  "schemaVersion": 1,
  "deploymentId": "deploy:customer-alpha:security-0.2.1",
  "applicationId": "customer-alpha",
  "environment": "production",
  "deployedAt": "2026-08-27T13:05:00.000Z",
  "approvedBy": {
    "kind": "workflow",
    "identity": "rootkeystudio/k-nex-platform-core/.github/workflows/deploy.yml@1b85599d919482a16885a922d816d7a3a1006082"
  },
  "artifactDigest": "sha256:9a159b56f05c478cf53a484719c04177c4675838e22f02faa1c1ce8bf9e37b13",
  "inventoryDigest": "sha256:71814c9b9b1a3d73b41e2c96bd9ce0a6de3a46711c5ecaaa0383ba205bbf4f6d",
  "migrationRevision": 8,
  "smoke": {
    "status": "passed",
    "checks": [
      "authenticated-sales",
      "public-shell"
    ]
  },
  "readiness": "ready"
}
