{
  "schemaVersion": 1,
  "deploymentId": "deploy:customer-alpha:1.0.0",
  "applicationId": "customer-alpha",
  "environment": "production",
  "deployedAt": "2026-09-01T12:05:00.000Z",
  "approvedBy": {
    "kind": "workflow",
    "identity": "rootkeystudio/k-nex-platform-core/.github/workflows/deploy.yml@e98d3d99552da78d27e6ec6f7a2147b4f4ea1d54"
  },
  "artifactDigest": "sha256:0d1787ed9726b00c5be2a6ce413798a28036dc1fb4cd4240624dafd3cbd43315",
  "inventoryDigest": "sha256:5f09fd1002f85dc03c75a2d8fd795d5391ac8a3e70adac109a3160cb155403eb",
  "migrationRevision": 1,
  "smoke": {
    "status": "passed",
    "checks": [
      "authenticated-sales",
      "public-shell"
    ]
  },
  "readiness": "ready"
}
